Verse,Text
1,Jekọb gara nʼihu nʼije ya rute nʼala dị nʼọwụwa anyanwụ. 
2,"NʼEbe Nsọ a, ọ hụrụ otu olulu mmiri, hụkwa ụzọ igwe atụrụ atọ ndị nọ nʼakụkụ olulu mmiri nʼihi na ndị na-elekọta ha na-enye ha mmiri site nʼolulu mmiri ahụ. Nkume e ji mechie ọnụ olulu mmiri ahụ buru ibu. "
3,"Nʼihi na mgbe igwe atụrụ niile bịazukọtara nʼolulu mmiri ahụ, ndị ọzụzụ atụrụ na-emeghepụ nkume ahụ nye ha mmiri. Emesịa, ha na-ejikwa nkume ahụ mechie ọnụ olulu mmiri ahụ."
4,"Jekọb jekwuru ndị na-elekọta atụrụ ahụ jụọ ha sị, “Ụmụnna m, ebee ka unu si?”"
5,"Ọ jụrụ ha sị, “Unu maara Leban, nwa Nahọ?”"
6,"Ọzọ Jekọb jụrụ ha sị, “Ahụ ọ dịkwa ya mma?”"
7,"Jekọb kwuru sị, “Lee, anyanwụ ka na-acha. O rubeghị oge e ji achịbata igwe ụmụ anụ ụlọ. Nyenụ ha mmiri ka ha ṅụọ, ka ha laghachi gaa taa ahịhịa.”"
8,"Ha zara sị ya, “Anyị agaghị enye ha mmiri tutu ruo mgbe igwe atụrụ niile bịakọtara, mgbe e wepụrụ nkume e ji mechie ọnụ olulu mmiri, mgbe ahụ ka anyị ga-enye ha mmiri.”"
9,"Mgbe Jekọb na ndị ọzụzụ atụrụ ndị a kpụ okwu nʼọnụ, Rechel chịịrị atụrụ nna ya bịakwute ha, nʼihi na onye ọzụzụ atụrụ nwanyị ka ọ bụ. "
10,"Mgbe Jekọb hụrụ Rechel nwa Leban nwanne nne ya, hụkwa igwe atụrụ Leban, ọ meghepụrụ nkume ahụ e ji mechie ọnụ olulu mmiri ahụ nye igwe atụrụ Leban, nwanne nne ya mmiri ka ha ṅụọ. "
11,"Emesịa, Jekọb suturu Rechel ọnụ, kwaa akwa nʼoke olu. "
12,"Jekọb kọwaara Rechel na ọ bụ onye ikwu nna ya, bụrụkwa nwa Ribeka. Nʼihi ya Rechel ji ọsọ gbalaa nʼụlọ ha kọọrọ nna ya."
13,"Mgbe Leban nụrụ maka Jekọb nwa nwanne ya nwanyị, o mere ngwangwa pụọ izute ya. Ọ makụrụ ya, sutu ya ọnụ, kpọrọ ya laa nʼụlọ. Nʼebe ahụ, Jekọb kọọrọ ya ihe ndị a niile. "
14,"Leban sịrị ya, “Nʼezie, ị bụ ọkpụkpụ m na anụ ahụ m.”"
15,"Leban sịrị Jekọb, “Ọ bụ nʼihi na ị bụ onye ikwu m ka ị na-agbara m odibo nʼefu? Gwa m ego ole m ga-akwụ gị nʼihi ọrụ ị na-arụrụ m?”"
16,Leban mụrụ ụmụ ndị inyom abụọ. Aha nke okenye bụ Lịa. Aha nke nta bụ Rechel. 
17,"Ịma mma Lịa dị ya nʼanya, ma Rechel mara mma nʼahụ, maakwa mma ile anya. "
18,"Ọ bụ Rechel ka Jekọb hụrụ nʼanya. Nʼihi ya Jekọb gwara Leban sị, “Aga m arụrụ gị ọrụ"
19,"Leban zara Jekọb sị ya, “Ọ dị mma na ị lụrụ Rechel karịa na onye ọzọ ga-alụ ya. Soro m nọdụ nʼebe a.” "
20,Ya mere Jekọb gbara odibo afọ asaa maka Rechel. Ma afọ asaa ndị a dịka abalị ole na ole nʼanya Jekọb nʼihi ịhụnanya o nwere nʼebe Rechel nọ.
21,"Jekọb gwara Leban, okwu sị ya, “Kpọnye m nwunye m nʼihi nʼụbọchị m ezuola. Achọrọ m ịbakwuru ya.”"
22,Leban kpọkọtara ndị niile bi nʼebe ahụ mere ha nʼoke oriri. 
23,"Nʼanyasị ụbọchị ahụ, Leban kpọọrọ nwa ya nwanyị bụ Lịa kpọbara Jekọb, ọ bakwuuru ya. "
24,"Leban nyekwara Lịa odibo ya, Zilpa, ka ọ bụrụ odibo nwanyị ya."
25,"Mgbe chi bọrọ, Jekọb hụrụ na ọ bụ Lịa ka Leban kpọnyere ya. Jekọb sịrị Leban, “Gịnị bụ ihe a i mere m? Ọ bụghị nʼihi Rechel ka m ji gbaara gị odibo? Gịnị mere i ji ghọgbuo m?”"
26,"Leban zara sị ya, “Ọ bụghị omenaala anyị ibu ụzọ kee nwantakịrị nwanyị nke nta di tupu nke ada. "
27,"Otu ọ dị, chere ka mmemme izu ụka nke onye nke a gafee. Mgbe ahụ, aga m akpọnyekwa gị onye nke ọzọ a maka odibo ị ga-agbara m afọ asaa ọzọ.”"
28,"Jekọb mere ka o si kwuo. O debezuru mmemme otu izu ụka onye nke a, Leban kpọnyere ya nwa ya Rechel ka ọ bụrụ nwunye ya. "
29,"Leban nyere nwa ya nwanyị, Rechel, odibo ya nwanyị bụ Bilha, ka ọ bụrụ odibo ya. "
30,Jekọb bakwukwara Rechel. Ọ hụrụ Rechel nʼanya nke ukwuu karịa Lịa. Ọ gbakwaara Leban odibo afọ asaa ọzọ.
31,Mgbe 
32,"Lịa tụrụ ime mụọ nwa nwoke, kpọọ ya Ruben. Nʼihi na o kwuru sị, “Ọ bụ nʼihi na "
33,"Ọ tụụrụ ime ọzọ mụọkwa nwa nwoke. O kwuru sị, “"
34,"Lịa tụrụ ime ọzọ, mgbe ọ mụrụ nwa nwoke, o kwuru sị, “Nʼezie, ugbu a ka di m ga-arapara m nʼahụ, nʼihi na amụọrala m ya ụmụ ndị ikom atọ.” Ya mere ọ kpọrọ aha ya Livayị."
35,"Ọ tụụrụ ime ọzọ mụọ nwa nwoke. O kwuru sị, “Ugbu a aga m eto "
