Verse,Text
1,"Uwe̩ ki li o̩kokuno̩ abe̩k e̩wño̩re̩ egini o̩maye-we̩ kʼi achila tinyo̩ kʼe̩ fʼeju kpʼuma bo n; alu du ki chaka de̩, uwe̩ ki ko ma dabiwa ñw o̩maye-we̩ chuu. "
2,"I la che̩wñ kʼo̩maye-we̩ le̩ ma me̩ru we̩ n, kʼe̩ ma la mʼo̩ n, e̩gbale̩ e̩ ki mʼu du wʼunyi e-we̩, oñ i adugbo we̩ gbogbo tak o̩maye-we̩ wa tene-wñ, tak uwe̩ ki mʼu du dabi wa ñw u. "
3,"Abe̩le̩ uwe̩ ñʼache kpai o̩ke̩ke̩te̩-wñ ge̩; abe̩le̩ uwe̩ la ache kpai e̩wñ o̩la-wñ; abe̩le̩ uwe̩ ki la che kpai e̩wñ o̩maye-we̩ du ki lenyo̩, kʼuwe̩ fʼu li; uwe̩ ki fʼe̩ya kpʼo̩ n. "
4,"Uwe̩ ki li kʼo̩ke̩ke̩te̩ abe̩k o̩kokuno̩ o̩maye-we̩ kʼi lewane̩ ej o̩na, kʼe̩ la fʼeju kpʼuma bo n; uwe̩ ki te̩kʼo kʼi ko ma kwane̩ chuu."
5,"Onobule̩ ki dʼe̩wñ e̩ne̩ke̩le̩ tʼo̩la n, e̩ne̩ke̩le̩ ki la dʼe̩wñ onobule̩ tʼo̩la n; todu e̩ne̩ du kʼi ache e̩wñ abe̩le̩ chʼe̩wñ ihie̩ne̩ ñwu Jihofa O̩jo̩-we̩."
6,"Iche̩wñ kʼe̩ lewa ke̩re̩bʼunyi e̩we̩ oj oli abe̩k ane̩pe̩te̩, kʼo̩ma jʼefu-wñ abe̩k e̩ge̩, kʼiye-wñ dadʼoj o̩ma-wñ abe̩k e̩ge̩-wñ, uwe̩ ki dʼiye-wñ manyʼo̩ma-wñ n; "
7,"uwe̩ ki tʼiye-wñ no̩ kʼi lo-wñ, e̩ muda neke kʼamo̩ma-wñ; todu ki ra ñw e̩, kʼuwe̩ ki kpojolugbo."
8,"E̩gba kʼe̩ fʼunyi etito̩ ko̩, mak uwe̩ ki fʼo̩gba bu nyʼo̩pata ojokunyi-wñ daka, tode̩gba kʼone̩ ñwa kwʼo̩mo̩ wane̩, kʼe̩ we efʼudu e̩bie̩ fa abʼunyi-we̩ ma."
9,"Uwe̩ ki kʼulu ojoji meji gbe̩ ef uche̩ achiwebe̩te̩ma-we̩ n, tode̩gba kʼe̩ro-wñ chaka afo̩, tʼe-ulu kʼe̩ du gbe̩ le̩, tʼunawo uche̩ achiwebe̩te̩ma-we̩ ge̩. "
10,E̩ ki du o̩kokuno̩ kpai o̩ke̩ke̩te̩ jimʼomune̩ kʼe̩ ne̩ luche̩ n. 
11,"E̩ ki la kʼukpo kʼowu meji kpe̩gwa nyu bʼo̩la ma n, owñ chʼedudu ala kpai owu e-owu edama."
12,Uwe̩ ki du o̩jaja nʼukpo ubo̩-lama-we̩ ago̩go̩-wñ me̩le̩.
13,"Iche̩wñ kʼone̩ fʼo̩ya ne̩, kʼi la nyʼejefu ugbo-wñ, kʼi chane̩ echulaka-wñ, "
14,"kʼi la dʼe̩wñ anyo̩ gwunʼo, kʼi je̩ ñw odu e̩bie̩ne̩ kwolamʼo̩ o̩la, kʼi kakini, Omi fʼonobule̩-i ne̩, tak e̩gba kʼu te̩me̩rʼu, u ke̩re̩bʼo̩ n; "
15,e̩gbale̩ ata igbe̩le̩ le̩ kpai iye-wñ akʼe̩wñ ijali aga igbe̩le̩ le̩ dufu wʼalaku ugbo abogijo ewo le̩; 
16,"tak ata igbe̩le̩ le̩ aka ñw abogijo kakini, U mʼo̩ma-mi du ñw e̩ne̩-i kʼi chʼo̩ya-wñ, oñ i chane̩ echʼulaka-wñ; "
17,"me̩ la go, i du e̩wñ anyo̩ gwunʼo, i kakini, U ke̩re̩bʼo̩ma-we̩ n. E̩wñ-i la chʼijali aga o̩ma-mi. Taku ma afʼukpo le̩ nadala jʼo̩gba abogijo ewo le̩. "
18,Tak abogijo ewo le̩ amʼe̩ne̩ke̩le̩ le̩ du ku ma kʼo̩ o̩la; 
19,"ma la abʼo̩ko̩ ajifa alu ejika ñw u, ku ma kʼe-le̩ ñw ata igbe̩le̩ le̩, todabu kʼe̩ne̩ le̩ je̩ ñw odu e̩bie̩ne̩ lamʼo̩ onobule̩ Israe̩l ki ma mʼe̩ne̩ke̩le̩ n o̩la: owñ le̩ la achʼo̩ya-wñ; i nʼugbo du kʼi adʼu tinyo̩ gbogbo mʼo̩jo̩ uku-wñ n. "
20,"I muda che̩wñ kʼo̩la le̩ chʼochochi ku ma ma li ijali aga-wñ ugbo igbe̩le̩ le̩ n, "
21,"e̩gbale̩ ma adʼigbe̩le̩ le̩ dufu wʼalugbo̩na unyi ata-wñ, tak aboke̩le̩ ewo-wñ ako okuta ro̩dʼo kʼi ku, todabu kʼi fʼe̩wñtuñ che ane̩ Israe̩l, owñ chʼo̩ko̩ kʼi je̩ ef unyi ata-wñ; abe̩le̩ oñ uwe̩ akʼe̩bie̩ne̩ rinyo̩ bʼalumeji-we̩ te̩."
22,"Iche̩wñ ku ma fʼe̩ne̩ke̩le̩ li abu kʼi abʼo̩ya e̩nomune̩ dachi, e̩gbale̩ amamejeji ki ku, tʼe̩ne̩ke̩le̩ kʼi bʼonobule̩ le̩ dachi, tʼonobule̩ le̩ ge̩; abe̩le̩ oñ uwe̩ akʼe̩bie̩ne̩ rinyo̩ bʼIsrae̩l te̩."
23,"Iche̩wñ kʼigbe̩le̩ kʼi ma mʼe̩ne̩ke̩le̩ n, e-ku ma du kpʼo̩ko̩ do̩mo̩, kʼe̩ne̩ke̩le̩ʼka fʼu li ef ewo, kʼi bʼo̩ dachi, "
24,"e̩gbale̩ ame̩ ki ko amamejeji dufu wʼalaku ewo le̩, ku me̩ kʼokuta kpa ma, e-igbe̩le̩ le̩ chʼutodabu kʼi de̩ ef ewo kʼi ma la kwa n, oñ e-e̩ne̩ke̩ke̩le̩ le̩ chʼutodabu kʼi fʼo̩ya ekeji-wñ kpabie̩; abe̩le̩ oñ uwe̩ akʼe̩bie̩ne̩ rinyo̩ bʼalumeji-we̩ te̩."
25,"I muda che̩wñ kʼe̩ne̩ke̩le̩ fʼigbe̩le̩ ku ma du kpʼo̩ko̩ li oko, kʼe̩ne̩ke̩le̩ le̩ fʼu demane̩, kʼi la bʼo̩ dachi, mak e̩gbale̩ e̩ne̩ke̩le̩ kʼi bʼo̩ dachi kate aku. "
26,"E̩ muda chʼigbe̩le̩ le̩ abu du n; adure ki bʼuku jo̩ dʼef igbe̩le̩ le̩ n; todu dabalu ki de̩ e̩gba kʼone̩ kwane̩ tʼekeji-wñ o̩la kʼi mʼu du kpa, abe̩le̩ o̩la-i de̩; "
27,"todu, i fʼu li oko, igbe̩le̩ ku ma du kpʼo̩ko̩ le̩ kwa i la nʼe̩ne̩ du kʼi ajadu-wñ n."
28,"Iche̩wñ kʼe̩ne̩ke̩le̩ fʼigbe̩le̩ kʼi ma mʼe̩ne̩ke̩le̩ n e-ku ma ma dʼu kpʼo̩ko̩ ta n li, kʼi la gwo̩nyʼu, kʼi bʼo̩ dachi, kʼone̩ lewa ke̩re̩bʼuma, "
29,"e̩gbale̩ e̩ne̩ke̩le̩ kʼi bʼo̩ dachi akʼo̩ko̩ ajifa ooje wa ñw ata igbe̩le̩ le̩, tak i mud o̩ya-wñ todabu kʼi fʼu kpabie̩; i la nʼugbo du kʼi adʼu tinyo̩ mʼo̩jo̩ uku-wñ n."
30,"One̩ ki ne̩ o̩ya ata-wñ n, i ki la chi ata-wñ ofe te̩ n."
