Verse,Text
1,"Yanzu fa Ibrahim ya tsufa, yana da shekaru masu yawa, "
2,"Sai Ibrahim ya ce wa babban bawan gidansa, wanda yake lura da duk abin da yake da shi, “Sa hannunka a ƙarƙashin cinyata. "
3,Ina so ka rantse da sunan 
4,"Amma za ka tafi ƙasata da kuma cikin ’yan’uwana, ka samo mata saboda ɗana Ishaku.”"
5,"Bawan ya ce masa, “Me zai faru in matar ba tă yarda tă zo tare da ni zuwa wannan ƙasa ba? In komar da ɗanka a ƙasar da ka fito ne ke nan?”"
6,"Ibrahim ya ce, “Ka tabbata ba ka komar da ɗana can ba.” "
7,Ubangiji
8,"In matar ba tă yarda tă zo tare da kai ba, za a kuɓutar da kai daga wannan rantsuwa. Sai dai kada ka kai ɗana a can.” "
9,"Saboda haka bawan ya sa hannunsa a ƙarƙashin cinyar maigidansa Ibrahim, ya kuma rantse masa game da wannan al’amari."
10,"Sai bawan ya ɗibi raƙuma goma na maigidansa ya tafi, ɗauke da kowane irin abubuwa masu kyau daga wurin maigidansa. Ya fita don yă tafi Aram-Naharayim, ya kama hanyarsa zuwa garin Nahor. "
11,"Ya sa raƙuman suka durƙusa kusa da rijiya a bayan gari; wajen yamma ne, lokacin da mata sukan fita ɗiban ruwa."
12,"Sai ya yi addu’a ya ce, “Ya "
13,"Duba, ina tsaye a bakin rijiyar ruwa, ’ya’ya matan mutanen gari kuma suna fitowa domin ɗiban ruwa. "
14,"Bari yă zama sa’ad da na ce wa wata yarinya, ‘Ina roƙonki ki saukar da tulunki domin in sha,’ in ta ce, ‘Ka sha, zan kuma ba wa raƙumanka ma’; bari tă zama ita ce ka zaɓa wa bawanka Ishaku. Ta haka zan san cewa ka nuna wa maigidana alheri.”"
15,"Kafin ya gama addu’a, sai Rebeka ta fito da tulu a kafaɗarta. Ita ’yar Betuwel ɗan Milka, matar Nahor, ɗan’uwan Ibrahim. "
16,"Yarinyar kuwa kyakkyawa ce, budurwa, ba namijin da ya taɓa kwana da ita. Ta gangara zuwa rijiyar, ta cika tulunta ta kuma hauro."
17,"Bawan ya yi sauri ya same ta ya ce, “Ina roƙonki ki ba ni ɗan ruwa daga tulunki.”"
18,"Ta ce, “Ka sha, ranka yă daɗe,” ta yi sauri ta saukar da tulun a hannuwanta, ta kuma ba shi, ya sha."
19,"Bayan ta ba shi ya sha, sai ta ce, “Zan ɗebo wa raƙumanka ruwa su ma, har sai sun gama sha.” "
20,"Sai ta yi sauri ta juye ruwan da yake tulunta cikin kwami, ta koma zuwa rijiyar da gudu don ta ƙara ɗebo ruwa, ta kuma ɗebo isashe saboda dukan raƙumansa. "
21,"Mutumin bai ce uffam ba, ya dai kalle ta sosai don yă san ko "
22,"Sa’ad da raƙuman suka gama shan ruwa, mutumin ya fitar da zoben hanci na zinariya mai nauyin giram biyar da woroworo biyu na zinariya masu nauyin shekel goma, ya ba ta. "
23,"Sa’an nan ya tambaye ta ya ce, “Ke ’yar wace ce? Ina roƙonki ki faɗa mini, akwai wuri a gidan mahaifinki da za mu kwana?”"
24,"Sai ta ce masa, “Ni ’yar Betuwel ce ɗan da Milka ta haifa wa Nahor.” "
25,"Ta ƙara da cewa, “Muna da isashen ciyawa da abincin dabbobi, da kuma wuri domin ku kwana.”"
26,Sa’an nan mutumin ya rusuna ya yi wa 
27,"yana cewa, “Yabo ya tabbata ga "
28,Yariyan ta gudu ta faɗa wa mutanen gidan mahaifiyarta game da abubuwan nan. 
29,"Rebeka fa tana da wani ɗan’uwa mai suna Laban, sai ya yi hanzari ya fita zuwa wurin mutumin a rijiyar. "
30,"Nan da nan da ya ga zoben hancin da woroworo a hannuwan ’yar’uwansa, ya kuma ji Rebeka ta faɗa abin da mutumin ya ce mata, sai ya fita zuwa wurin mutumin, ya same shi yana tsaye wajen raƙuma kusa da rijiyar. "
31,"Sai ya ce, “Zo, ya kai mai albarka na "
32,"Don haka mutumin ya tafi gidan, aka kuma saukar da kaya kan raƙuman. Aka kawo wa raƙuman ciyawa da abincin dabbobi, aka kuma kawo ruwa dominsa da mutanensa su wanke ƙafafunsu. "
33,"Sa’an nan aka ajiye abinci a gabansa, amma ya ce, “Ba zan ci ba, sai na faɗi abin da yake tafe da ni.”"
34,"Saboda haka ya ce, “Ni bawan Ibrahim ne. "
35,Ubangiji
36,"Saratu matar maigidana ta haifa masa ɗa a tsufanta, ya kuma ba shi duk mallakarsa. "
37,"Maigidana ya sa na yi rantsuwa, ya kuma ce, ‘Kada ka ɗauko wa ɗana mata daga ’ya’ya matan Kan’aniyawa, waɗanda nake zama a ƙasarsu, "
38,"amma ka tafi wajen gidan mahaifina da kuma dangina, ka ɗauko wa ɗana mata.’"
39,"“Sai na ce wa maigidana, ‘A ce matar ba tă yarda tă zo tare da ni ba fa?’"
40,"“Maigidana ya ce, ‘"
41,"Ta haka za ka kuɓuta daga rantsuwata sa’ad da ka tafi wurin dangina, ko ma sun ƙi su ba ka ita, za ka kuɓuta daga rantsuwata.’"
42,"“Sa’ad da na zo rijiya a yau, na ce, ‘Ya "
43,"Duba, ina tsaye kusa da wannan rijiya; in wata yarinya ta fito domin tă ɗiba ruwa, wadda in na ce mata, “Ina roƙonki bari in ɗan sha ruwa daga tulunki,” "
44,"in ta ce, “Ka sha, zan kuma ba wa raƙumanka ma,” bari tă zama wadda "
45,"“Kafin in gama addu’ar, a zuciyata, sai ga Rebeka ta fito da tulunta a kafaɗarta. Ta gangara zuwa rijiyar ta ɗebo ruwa, na kuma ce mata, ‘Ina roƙonki ki ba ni ɗan ruwa daga tulunki.’"
46,"“Ta yi sauri ta saukar da tulun daga kafaɗarta ta ce, ‘Sha, zan kuma ba wa raƙumanka su ma.’ Sai na sha, ta kuma shayar da raƙumana su ma."
47,"“Na tambaye ta, ‘Ke ’yar wane ne?’"
48,na kuma sunkuya na yi wa 
49,"Yanzu fa in za ku nuna wa maigidana alheri da aminci, ku faɗa mini, in kuma ba haka ba, ku faɗa mini, don in san hanyar da zan juya.”"
50,"Laban da Betuwel suka ce, “Wannan daga wurin "
51,"Ga Rebeka, ɗauke ta ku tafi, bari tă zama matar ɗan maigidanka, yadda "
52,"Sa’ad da bawan Ibrahim ya ji abin da suka ce, sai ya rusuna har ƙasa a gaban "
53,Sa’an nan bawan ya fito da kayan ado na zinariya da azurfa da kayayyaki na tufafi ya ba wa Rebeka; ya kuma ba wa ɗan’uwanta da mahaifiyarta kyautai masu tsada. 
54,"Sa’an nan shi da mutanen da suke tare da shi suka ci, suka sha, suka kuma kwana a can."
55,"Amma ɗan’uwanta da mahaifiyarta suka ce, “Bari yarinyar ta ɗan zauna tare da mu kwana goma ko fiye, sa’an nan ka"
56,"Amma ya ce musu, “Kada ku tsai da ni, tun da "
57,"Sa’an nan suka ce, “Bari mu kira yarinyar mu tambaye ta game da zancen.” "
58,"Saboda haka suka kira Rebeka suka ce mata, “Za ki tafi tare da mutumin nan?”"
59,"Saboda haka suka sallame Rebeka, ’yar’uwarsu, duk da uwar goyonta da bawan Ibrahim da mutanensa. "
60,"Suka kuma albarkaci Rebeka suka ce mata,"
61,Sa’an nan Rebeka da bayinta mata suka shirya suka hau raƙumansu suka koma tare da mutumin. Da haka bawan ya ɗauki Rebeka ya tafi.
62,"Ishaku kuwa ya zo daga Beyer-Lahai-Royi, gama yana zama a Negeb. "
63,Wata rana da yamma ya fita zuwa fili domin yă yi tunani
64,"Rebeka ma ta ɗaga ido sai ta ga Ishaku. Ta sauka daga raƙuminta da sauri, "
65,"ta ce wa bawan, “Wane ne mutumin can a fili, da yake zuwa yă tarye mu?”"
66,Sai bawan ya faɗa wa Ishaku duk abin da ya yi. 
67,"Ishaku ya kawo ta cikin tentin mahaifiyarsa Saratu, ya kuma auri Rebeka. Ta haka ta zama matarsa, ya kuwa ƙaunace ta; Ishaku kuma ya ta’azantu bayan rasuwar mahaifiyarsa."
